1,get_document_description,"Act as if you are a medical office assistant who follows direction precisely and consistently when identifying a document. Review the above document and provide only the output using the specified output format, without labeling it as output format:, after review perform through the following steps. 1. Select pathology type from  PATHOLOGY TESTS LIST provided below. If the provided laboratory tests list does not provide a strong match display the word 'Other'. Output format template: pathology type (name of the laboratory). Ensure this output format template is followed precisly including brackets (), the output must not be enclosed with quotation marks, and the output must end without a period. A laboratory with the address of 100 International Blvd Toronto has the name LifeLabs. For reference these are examples using this output template 'Biopsy colon (HRH), Bone Marrow (Markham Stouffville), Endometrial biopsy (NYGH), Bloodwork (LifeLabs). PATHOLOGY TESTS LIST: Colon biopsy, Gastric biopsy, Bone marrow biopsy, Endometrial Biopsy, FNA biopsy, HPV PCR, PAP Test Cytopathology, STI tests, GC & Chlam, HIV, Skin Biopsy, Blood Culture, Urinalysis, Culture and Sensitivity, CBC, Liver Function, Thyroid Function, Immune Serology, Inflammatory Markers, Genetics, Coagulation Profile, Tissue Biopsy, Sputum sample.",1,1
1,getProviderList,"Based on the above document, select the appropriate provider from the following list who requested for this document and only return the provider number (eg: 20) nothing else",exit,exit
1,build_sub_prompt,"For the following question if confidence level is more than 85% give the  answer in one word using the format 'True' else 'False'. Does the document has the name of the family doctor?. ",3,2
1,get_doctor_name,"Answer only to the following question in two words; and the answer should be in the following format; do not add 'Dr.' to reply. Format : Lastname, Firstname. What is the lastname and firstname of the doctor who requested for this document? Answer Format (Lastname, Firstname)",4,4
1,get_doctor_name,"Answer only to the following question in two words; and the answer should be in the following format; do not add 'Dr.' to reply. Format : Lastname, Firstname. What is the lastname and firstname of the family doctor? Answer Format (Lastname, Firstname)",4,4
1,filter_results,"For the following always use only double quotes instead of single quotes. Choose one from the following list that suits doctor who requested for this document based on the details given and give the selected item including the providerNo. Make sure the response is just the selected item from the given list with all the details (firstName, lastName, ohipNo, providerNo) from the list in the provided format as of the question. Make sure the response is just the selected item, nothing else! Do not add any other text than the result! Response should be in JSON format, not as a string, and property names such as firstName, lastName, ohipNo, providerNo (keys) to be enclosed in double quotes. Make sure the property names are enclosed in double quotes!",5,5
1,set_doctor,exit,exit
