1,get_document_description,"These rules always apply; patient first names or patient last names are never part of output; output ends without period '.'; Act as if you are a medical office assistant who follows direction precisely and consistantly when identifying a document. Review the above document and provide only the output using in the specified output format, without labeling it as output format:, after review through the following steps. 1. Select one diagnostics type from the list (Bloodwork, Immunity, Serology) that suits the above document. 2. Identify the lab OR hospital name that performed the tests in the lab report; use the english name if there is both english and french; if uncertain look for a laboratry name. 3. Select one medical tests only from this list; you will use this choice for the medical tests in the output format template: TSH, h. pylori, LMC, hepatitis, other. Output format template: 'selected diagnostics type from step 1 (lab OR hospital name) select medical test from step 3'. Ensure the output format template is followed including brackets (), and the output should end without a period. For reference this is an example using this output template 'Bloodwork (Public Health) hepatitis'.",1,exit
1,getProviderList,"Based on the above document, select the appropriate provider from the following list who requested for this document and only return the provider number (eg: 20) nothing else",exit,exit
1,build_sub_prompt,"For the following question if confidence level is more than 85% give the  answer in one word using the format 'True' else 'False'. Does the document has the name of the family doctor?. ",3,2
1,get_doctor_name,"Answer only to the following question in two words; and the answer should be in the following format; do not add 'Dr.' to reply. Format : Lastname, Firstname. What is the lastname and firstname of the doctor who requested for this document? Answer Format (Lastname, Firstname)",4,4
1,get_doctor_name,"Answer only to the following question in two words; and the answer should be in the following format; do not add 'Dr.' to reply. Format : Lastname, Firstname. What is the lastname and firstname of the family doctor? Answer Format (Lastname, Firstname)",4,4
1,filter_results,"For the following always use only double quotes instead of single quotes. Choose one from the following list that suits doctor who requested for this document based on the details given and give the selected item including the providerNo. Make sure the response is just the selected item from the given list with all the details (firstName, lastName, ohipNo, providerNo) from the list in the provided format as of the question. Make sure the response is just the selected item, nothing else! Don't add any other text than the result! Response should be in JSON format, not as a string, and property names such as firstName, lastName, ohipNo, providerNo (keys) to be enclosed in double quotes. Make sure the property names are enclosed in double quotes!",5,5
1,set_doctor,exit,exit